id	course_name	course_language	course_short_name	categories	universities	categories_name	universities_name
504	Введение в биоинформатику (Introduction to Bioinformatics)	ru	bioinfo	[1, 4, 8, 10]	[179]	 Computer Science: Theory + Information, Tech & Design + Health & Society + Biology & Life Sciences	 Saint Petersburg State University
505	Building an Information Risk Management Toolkit	en	inforisk	[4, 11, 13]	[15]	 Information, Tech & Design + Computer Science: Systems & Security + Business & Management	 University of Washington
506	Australian literature: a rough guide	en	auslitroughguide	[6, 22]	[156]	 Humanities  + Arts	 University of Western Australia
507	English Composition I	en	composition	[6, 14, 20, 26]	[7]	 Humanities  + Education + Social Sciences + Teacher Professional Development	 Duke University
508	关爱生命--实用急救与自救技能	zh-cn	sjtufirstaid	[3, 8]	[150]	 Medicine + Health & Society	 Shanghai Jiao Tong University
509	Teaching and Assessing Clinical Skills	en	clinicalskills	[3, 8]	[3]	 Medicine + Health & Society	 University of Michigan
510	C++ For C Programmers	en	cplusplus4c	[12]	[56]	 Computer Science: Software Engineering	 University of California, Santa Cruz
511	Nudge-it: Understanding obesity	en	nudgeit	[2, 3, 8, 10, 19]	[14]	 Economics & Finance + Medicine + Health & Society + Biology & Life Sciences + Food and Nutrition	 The University of Edinburgh
512	Launching New Ventures	en	venture	[2, 4, 13]	[16]	 Economics & Finance + Information, Tech & Design + Business & Management	 École Polytechnique Fédérale de Lausanne
513	Neuroethics	en	neuroethics	[8]	[6]	 Health & Society	 University of Pennsylvania
514	Understanding Research: An Overview for Health Professionals	en	researchforhealth	[3, 8]	[10]	 Medicine + Health & Society	 University of California, San Francisco
515	Curanderismo Part 3: Traditional Healing with Cultural Traditions	en	tradhealingculture	[3, 6, 8, 19]	[120]	 Medicine + Humanities  + Health & Society + Food and Nutrition	 University of New Mexico
516	Nutrition for Health Promotion and Disease Prevention	en	nutrition	[2, 3, 8, 19]	[10]	 Economics & Finance + Medicine + Health & Society + Food and Nutrition	 University of California, San Francisco
517	Forests and Humans: From the Midwest to Madagascar	en	forestshumans	[9, 10, 25]	[65]	 Physical & Earth Sciences + Biology & Life Sciences + Energy & Earth Sciences	 University of Wisconsin–Madison
518	Audio Signal Processing for Music Applications	en	audio	[4, 15, 18]	[1, 225]	 Information, Tech & Design + Engineering + Music, Film, and Audio	 Stanford University
519	Statistical Reasoning for Public Health 1: Estimation, Inference, & Interpretation	en	statreasoning	[3, 5, 10]	[8]	 Medicine + Mathematics + Biology & Life Sciences	 Johns Hopkins University
520	Introduction to Tissue Engineering	en	tissue101	[10, 15]	[24]	 Biology & Life Sciences + Engineering	 Hebrew University of Jerusalem
521	AstroTech: The Science and Technology behind Astronomical Discovery	en	astrotech	[9, 16, 23]	[14]	 Physical & Earth Sciences + Statistics and Data Analysis + Physics	 The University of Edinburgh
522	История экономической мысли (History of Economic Thought)	ru	historyofec	[2]	[160]	 Economics & Finance	 Higher School of Economics
523	Live!:  A History of Art for Artists, Animators and Gamers	en	livearthistory	[6, 18, 22]	[59]	 Humanities  + Music, Film, and Audio + Arts	 California Institute of the Arts
524	Compilers	en	compilers	[11, 12]	[1]	 Computer Science: Systems & Security + Computer Science: Software Engineering	 Stanford University
525	Introducción a la Contabilidad Financiera	es	whartonaccountinges	[13]	[6]	 Business & Management	 University of Pennsylvania
526	Preparing for the AP* Calculus AB and BC Exams	en	apcalc	[5]	[119]	 Mathematics	 University of Houston System
527	Dairy Production and Management	en	dairy	[10, 19]	[51]	 Biology & Life Sciences + Food and Nutrition	 The Pennsylvania State University
528	Сравнительная политика (Comparative Politics)	ru	compol	[20]	[160]	 Social Sciences	 Higher School of Economics
529	Preparation for General Chemistry	en	chemprep	[24]	[67]	 Chemistry	 Rutgers the State University of New Jersey
530	Inspiring Leadership through Emotional Intelligence	en	lead-ei	[13, 14, 20]	[68]	 Business & Management + Education + Social Sciences	 Case Western Reserve University
531	Managerial Accounting: Cost Behaviors, Systems, and Analysis	en	acctcostanalysis	[13]	[17]	 Business & Management	 University of Illinois at Urbana-Champaign
532	Cryptography II	en	crypto2	[1, 11]	[1]	 Computer Science: Theory + Computer Science: Systems & Security	 Stanford University
533	Financial Planning for Young Adults	en	personalfinance	[2, 13]	[17]	 Economics & Finance + Business & Management	 University of Illinois at Urbana-Champaign
534	医学图像处理技术 Medical Image Analysis	zh-cn	sjtumia	[3, 12]	[150]	 Medicine + Computer Science: Software Engineering	 Shanghai Jiao Tong University
535	Modeling Discrete Optimization	en	modelingoptimization	[17]	[33]	 Computer Science: Artificial Intelligence	 The University of Melbourne
536	Programming Mobile Applications for Android Handheld Systems: Part 1	en	androidpart1	[4, 12]	[32]	 Information, Tech & Design + Computer Science: Software Engineering	 University of Maryland, College Park
537	Foundations for Assisting in Home Care	en	hha	[3, 8, 14]	[117]	 Medicine + Health & Society + Education	 The State University of New York
538	Game Theory II: Advanced Applications	en	gametheory2	[1, 2, 17]	[1]	 Computer Science: Theory + Economics & Finance + Computer Science: Artificial Intelligence	 Stanford University
539	Foundations of Teaching for Learning 7: Being a Professional	en	teach7	[14, 26]	[106]	 Education + Teacher Professional Development	 Commonwealth Education Trust
540	Big Data Analytics for Healthcare	en	bigdataanalytics	[3, 15]	[9]	 Medicine + Engineering	 Georgia Institute of Technology
541	Éléments de Géomatique	fr	geomatique	[9, 15]	[16]	 Physical & Earth Sciences + Engineering	 École Polytechnique Fédérale de Lausanne
542	Networked Life	en	networks	[2, 4, 17, 20]	[6]	 Economics & Finance + Information, Tech & Design + Computer Science: Artificial Intelligence + Social Sciences	 University of Pennsylvania
543	Foundational Neuroscience for Perception and Action	en	foundationmedneuro	[3, 10, 26]	[7]	 Medicine + Biology & Life Sciences + Teacher Professional Development	 Duke University
544	Climate Change Policy and Public Health	en	ccandph	[3, 8, 9, 10]	[65]	 Medicine + Health & Society + Physical & Earth Sciences + Biology & Life Sciences	 University of Wisconsin–Madison
545	Health Literacy and Communication for Health Professionals	en	healthliteracy	[3, 8]	[124]	 Medicine + Health & Society	 University of Nebraska
546	東坡詞 (Ci Poetry of Su Dong Po)	zh-tw	dpc	[6]	[75]	 Humanities 	 National Taiwan University
547	Inquiry Science Learning: Perspectives and Practices 2 - Techniques for Success	en	inquirytechniques	[14, 26]	[13]	 Education + Teacher Professional Development	 Rice University
548	Energy and the Earth	en	earthenergy	[9, 15, 25]	[65]	 Physical & Earth Sciences + Engineering + Energy & Earth Sciences	 University of Wisconsin–Madison
549	Introduction to User Interface Design (Part 1)	en	uidesign1	[4]	[9]	 Information, Tech & Design	 Georgia Institute of Technology
550	Wheels of Metals: Urban Mining for a Circular Economy	en	metals	[9, 14, 25]	[25]	 Physical & Earth Sciences + Education + Energy & Earth Sciences	 Universiteit Leiden
551	Student Thinking at the Core	en	corethink	[14, 26]	[37]	 Education + Teacher Professional Development	 Vanderbilt University
552	Representaciones Culturales de las Sexualidades 	es	representaciones	[6, 22]	[80]	 Humanities  + Arts	 Universitat Autònoma de Barcelona
553	Technology and Ethics	en	techethics	[4, 6, 20]	[28]	 Information, Tech & Design + Humanities  + Social Sciences	 The Ohio State University
554	Advanced Instructional Strategies in the Virtual Classroom	en	advancedvirtual	[]	[30]		 University of California, Irvine
555	An Introduction to the U.S. Food System: Perspectives from Public Health	en	foodsys	[8, 19]	[8]	 Health & Society + Food and Nutrition	 Johns Hopkins University
556	Global Affairs Final Project	en	globalaffairsfinal	[20]	[25, 49]	 Social Sciences	 Universiteit Leiden + University of Geneva
557	Principles of Macroeconomics	en	macroeconomics	[2]	[33]	 Economics & Finance	 The University of Melbourne
558	Understanding Russians: Contexts of Intercultural Communication	en	russians	[6]	[160]	 Humanities 	 Higher School of Economics
559	Conception et mise en œuvre d'algorithmes.	fr	algoprog	[1]	[66]	 Computer Science: Theory	 École Polytechnique
560	Институциональная экономика (Institutional economics)	ru	instec	[2]	[160]	 Economics & Finance	 Higher School of Economics
561	Understanding the UK's 2015 General Election	en	ge2015	[6, 13, 16, 20]	[14]	 Humanities  + Business & Management + Statistics and Data Analysis + Social Sciences	 The University of Edinburgh
562	Algorithms, Biology, and Programming for Beginners	en	algobioprogramming	[1, 4, 5, 10, 12]	[53]	 Computer Science: Theory + Information, Tech & Design + Mathematics + Biology & Life Sciences + Computer Science: Software Engineering	 University of California, San Diego
563	American Health Policy: The Structure of the American Health Care System (Part I of II)	en	americanhealthsystem	[2, 8]	[6]	 Economics & Finance + Health & Society	 University of Pennsylvania
564	Subsistence Marketplaces	en	subsistence	[13]	[17]	 Business & Management	 University of Illinois at Urbana-Champaign
565	Algorithmic Thinking (Part 1)	en	algorithmicthink1	[1, 12]	[13]	 Computer Science: Theory + Computer Science: Software Engineering	 Rice University
566	Valuing Projects and Companies	en	valuingcompanies	[2, 13]	[3]	 Economics & Finance + Business & Management	 University of Michigan
567	Volcanic Eruptions: a material science.	en	volcano	[9, 25]	[64]	 Physical & Earth Sciences + Energy & Earth Sciences	 Ludwig-Maximilians-Universität München (LMU)
568	人工智慧(Artificial Intelligence)	zh-tw	ai	[17]	[75]	 Computer Science: Artificial Intelligence	 National Taiwan University
569	Recovering the Humankind's Past and Saving the Universal Heritage	en	recoveringthepast	[6]	[74]	 Humanities 	 Sapienza University of Rome
570	Content Strategy for Professionals 3: Capstone Project	en	contentcapstone	[4, 13]	[54]	 Information, Tech & Design + Business & Management	 Northwestern University
571	Brand Management: Aligning Business, Brand and Behaviour	en	brand	[13]	[26]	 Business & Management	 University of London
572	More Introduction to Financial Accounting	en	accountingmore	[2, 13]	[6]	 Economics & Finance + Business & Management	 University of Pennsylvania
573	Childbirth: A Global Perspective	en	pregnancychildbirth	[6, 8, 10, 20]	[23]	 Humanities  + Health & Society + Biology & Life Sciences + Social Sciences	 Emory University
574	Latino Popular Culture for the Clueless	en	latinopop	[6]	[28]	 Humanities 	 The Ohio State University
575	Computational Photography	en	compphoto	[4, 17]	[9]	 Information, Tech & Design + Computer Science: Artificial Intelligence	 Georgia Institute of Technology
576	Conditions of War and Peace	en	warandpeace	[6, 20]	[76]	 Humanities  + Social Sciences	 The University of Tokyo
577	The Language of Hollywood: Storytelling, Sound, and Color	en	hollywood	[6, 18]	[34]	 Humanities  + Music, Film, and Audio	 Wesleyan University
578	Philosophy and the Sciences	en	philsci	[6, 9, 17, 23]	[14]	 Humanities  + Physical & Earth Sciences + Computer Science: Artificial Intelligence + Physics	 The University of Edinburgh
579	Analysis of Algorithms	en	aofa	[1, 5]	[4]	 Computer Science: Theory + Mathematics	 Princeton University
580	Globalization and You	en	globalization	[2, 6, 20]	[15]	 Economics & Finance + Humanities  + Social Sciences	 University of Washington
581	Engaging Citizens:  A Game Changer for Development?	en	engagecitizen	[2, 4, 6, 20]	[73]	 Economics & Finance + Information, Tech & Design + Humanities  + Social Sciences	 The World Bank Group
582	Rethinking Ageing:  Are we prepared to live longer?	en	ageing	[2, 4, 8, 20]	[33]	 Economics & Finance + Information, Tech & Design + Health & Society + Social Sciences	 The University of Melbourne
583	The Beauty of Kunqu Opera | 崑曲之美	zh-tw	kunqu	[22]	[45]	 Arts	 The Chinese University of Hong Kong
584	 Java程序设计	zh-cn	pkujava	[12]	[163]	 Computer Science: Software Engineering	 Peking University
585	Physique des cellules solaires au silicium	fr	enrpv	[9, 23, 25]	[66]	 Physical & Earth Sciences + Physics + Energy & Earth Sciences	 École Polytechnique
586	Reasoning, Data Analysis, & Writing Final Project	en	reasoningcapstone	[6, 16]	[7]	 Humanities  + Statistics and Data Analysis	 Duke University
587	Vital Signs: Understanding What the Body Is Telling Us	en	vitalsigns	[3, 10]	[6]	 Medicine + Biology & Life Sciences	 University of Pennsylvania
588	Confronting Gender Based Violence: Global Lessons with Case Studies from India	en	gbv	[3, 8, 20]	[8]	 Medicine + Health & Society + Social Sciences	 Johns Hopkins University
589	Ocean Solutions	en	oceansolutions	[9, 10, 25]	[156]	 Physical & Earth Sciences + Biology & Life Sciences + Energy & Earth Sciences	 University of Western Australia
590	Informatik für Ökonomen	de	inf4oec	[4, 13]	[93]	 Information, Tech & Design + Business & Management	 University of Zurich
591	Changing Weather and Climate in the Great Lakes Region	en	greatlakesclimate	[8, 9, 20, 25, 26]	[65]	 Health & Society + Physical & Earth Sciences + Social Sciences + Energy & Earth Sciences + Teacher Professional Development	 University of Wisconsin–Madison
592	Mining Massive Datasets	en	mmds	[11, 17]	[1]	 Computer Science: Systems & Security + Computer Science: Artificial Intelligence	 Stanford University
593	Android Capstone Project	en	androidcapstone	[]	[32, 37]		 University of Maryland, College Park + Vanderbilt University
594	TechniCity	en	techcity	[4]	[28]	 Information, Tech & Design	 The Ohio State University
595	Algorithms, Part I	en	algs4partI	[1, 12]	[4]	 Computer Science: Theory + Computer Science: Software Engineering	 Princeton University
596	Foundations of E-Commerce 	en	ntuecom	[4, 13]	[121]	 Information, Tech & Design + Business & Management	 Nanyang Technological University, Singapore
597	Humanitarian communication : Addressing key challenges	en	hacommunication	[20]	[49]	 Social Sciences	 University of Geneva
598	Exercise Physiology: Understanding the Athlete Within	en	exphys	[3, 10]	[33]	 Medicine + Biology & Life Sciences	 The University of Melbourne
599	Critical Thinking in Global Challenges	en	criticalthinking	[8, 10, 25]	[14]	 Health & Society + Biology & Life Sciences + Energy & Earth Sciences	 The University of Edinburgh
600	Machine Learning	en	machlearning	[16, 17]	[15]	 Statistics and Data Analysis + Computer Science: Artificial Intelligence	 University of Washington
601	悖论：思维的魔方	zh-cn	paradox	[6]	[163]	 Humanities 	 Peking University
602	操作系统与虚拟化安全	zh-cn	osvirtsecurity	[11]	[163]	 Computer Science: Systems & Security	 Peking University
603	家庭社会学导论	zh-cn	pkufamilysociology	[20]	[163]	 Social Sciences	 Peking University
604	Maps and the Geospatial Revolution	en	maps	[4, 16, 20]	[51]	 Information, Tech & Design + Statistics and Data Analysis + Social Sciences	 The Pennsylvania State University
605	Conversations that Inspire: Coaching Learning, Leadership and Change	en	coaching	[6, 13, 14, 20]	[68]	 Humanities  + Business & Management + Education + Social Sciences	 Case Western Reserve University
606	Beginning Game Programming with C#	en	gameprogramming	[12]	[126]	 Computer Science: Software Engineering	 University of Colorado System
607	Introduction to Sociology	en	soc101	[20]	[4]	 Social Sciences	 Princeton University
608	Algorithms: Design and Analysis, Part 1	en	algo	[1]	[1]	 Computer Science: Theory	 Stanford University
609	Public-Private Partnerships (PPP): How can PPPs help deliver better services?	en	effectiveppp	[2, 6, 13, 15, 20]	[73]	 Economics & Finance + Humanities  + Business & Management + Engineering + Social Sciences	 The World Bank Group
610	Analyse numérique pour ingénieurs	fr	analysenumerique	[5]	[16]	 Mathematics	 École Polytechnique Fédérale de Lausanne
611	High Performance Scientific Computing	en	scicomp	[4, 16]	[15]	 Information, Tech & Design + Statistics and Data Analysis	 University of Washington
612	Think Again: How to Reason and Argue	en	thinkagain	[6, 26]	[7]	 Humanities  + Teacher Professional Development	 Duke University
613	Comprendre les Microcontrôleurs	fr	microcontroleurs	[4, 15]	[16]	 Information, Tech & Design + Engineering	 École Polytechnique Fédérale de Lausanne
614	Drug Discovery, Development & Commercialization 	en	drugdiscovery	[3, 10]	[53]	 Medicine + Biology & Life Sciences	 University of California, San Diego
615	Nutrition, Health, and Lifestyle: Issues and Insights	en	lifenutr	[10, 19]	[37]	 Biology & Life Sciences + Food and Nutrition	 Vanderbilt University
616	Online Games: Literature, New Media, and Narrative	en	onlinegames	[6, 22]	[37]	 Humanities  + Arts	 Vanderbilt University
617	Global Environmental Management	en	globalenvmanangement	[8, 9, 15, 20, 25]	[57]	 Health & Society + Physical & Earth Sciences + Engineering + Social Sciences + Energy & Earth Sciences	 Technical University of Denmark (DTU)
618	Programmed cell death	en	pcd	[3, 10]	[64]	 Medicine + Biology & Life Sciences	 Ludwig-Maximilians-Universität München (LMU)
619	Archaeology's Dirty Little Secrets	en	secrets	[6, 9, 20, 22, 25]	[22]	 Humanities  + Physical & Earth Sciences + Social Sciences + Arts + Energy & Earth Sciences	 Brown University
620	Линейная алгебра (Linear Algebra)	ru	linalg	[5]	[160]	 Mathematics	 Higher School of Economics
621	企业金融概论（中文版）	zh-cn	whartonfinancezh	[2, 13]	[6]	 Economics & Finance + Business & Management	 University of Pennsylvania
622	Continuidad y desarrollo de la empresa familiar	es	empresafamiliar	[2, 13, 20]	[62]	 Economics & Finance + Business & Management + Social Sciences	 Tecnológico de Monterrey
623	História da Contabilidade	pt-br	histcontabilidade	[2, 13]	[221]	 Economics & Finance + Business & Management	 Universidade de São Paulo
624	Sustainability of Food Systems: A Global Life Cycle Perspective	en	globalfoodsystems	[2, 19, 25]	[50]	 Economics & Finance + Food and Nutrition + Energy & Earth Sciences	 University of Minnesota
625	Water in the Western United States	en	waterwestus	[9, 14, 20, 26]	[71, 126]	 Physical & Earth Sciences + Education + Social Sciences + Teacher Professional Development	 University of Colorado Boulder + University of Colorado System
626	Moralities of Everyday Life	en	moralities	[6, 20]	[109]	 Humanities  + Social Sciences	 Yale University
627	Fog Networks and the Internet of Things	en	fog	[12, 15]	[4]	 Computer Science: Software Engineering + Engineering	 Princeton University
628	Programming Mobile Services for Android Handheld Systems: Concurrency	en	posaconcurrency	[4, 11, 12]	[37]	 Information, Tech & Design + Computer Science: Systems & Security + Computer Science: Software Engineering	 Vanderbilt University
629	Introducción al Marketing	es	whartonmarketinges	[13]	[6]	 Business & Management	 University of Pennsylvania
630	New World, New Map: GPS for Today’s Music Industry	en	gpsmusic	[2, 6, 13, 18]	[116]	 Economics & Finance + Humanities  + Business & Management + Music, Film, and Audio	 West Virginia University
631	Principles of Economics for Scientists	en	econ1scientists	[2]	[12]	 Economics & Finance	 Caltech
632	Collaboration and Communication in Healthcare: Interprofessional Practice	en	interprofessional	[3, 8, 14]	[10]	 Medicine + Health & Society + Education	 University of California, San Francisco
633	Science, Technology, and Society in China I: Basic Concepts	en	stschina1	[20]	[35]	 Social Sciences	 The Hong Kong University of Science and Technology
634	Fundamentals of Music Theory	en	musictheory	[18]	[14]	 Music, Film, and Audio	 The University of Edinburgh
635	Economics of Transition and Emerging Markets	en	etem	[2]	[160]	 Economics & Finance	 Higher School of Economics
636	Responding to 9/11: Counterterrorism Policy in the 21st Century	en	respondingto911	[20, 26]	[7]	 Social Sciences + Teacher Professional Development	 Duke University
637	Startup Engineering	en	startup	[12, 13, 16]	[1]	 Computer Science: Software Engineering + Business & Management + Statistics and Data Analysis	 Stanford University
638	The Global Student's Introduction to U.S. Law	en	globalintrouslaw	[21]	[31]	 Law	 University of Florida
639	Effective Classroom Interactions: Supporting Young Children’s Development	en	earlychildhood	[14, 26]	[18]	 Education + Teacher Professional Development	 University of Virginia
640	Teaching goes massive: new skills required	en	massiveteaching	[14, 26]	[93]	 Education + Teacher Professional Development	 University of Zurich
641	Take the Lead on Healthcare Quality Improvement	en	hcqualityimprovement	[3, 8]	[68]	 Medicine + Health & Society	 Case Western Reserve University
642	Data Visualization	en	datavisualization	[4, 12, 16]	[17]	 Information, Tech & Design + Computer Science: Software Engineering + Statistics and Data Analysis	 University of Illinois at Urbana-Champaign
643	Common Core in Action II: Exploring Literacy Design Collaborative Tools	en	cc2lit	[14, 26]	[103]	 Education + Teacher Professional Development	 New Teacher Center
644	Aléatoire : une introduction aux probabilités 	fr	probas	[5]	[66]	 Mathematics	 École Polytechnique
645	"""Pay Attention!!"" ADHD Through the Lifespan"	en	adhd	[3]	[6]	 Medicine	 University of Pennsylvania
646	How to Succeed in College	en	succeedincollege	[14]	[127]	 Education	 University of Kentucky
647	Learning for Sustainability: Developing a personal ethic	en	sustainability	[14, 20, 25, 26]	[14]	 Education + Social Sciences + Energy & Earth Sciences + Teacher Professional Development	 The University of Edinburgh
648	История и теория медиа (History and theory of media)	ru	media	[6, 20]	[160]	 Humanities  + Social Sciences	 Higher School of Economics
649	Introduction to Mathematical Philosophy	en	mathphil	[5, 6]	[64]	 Mathematics + Humanities 	 Ludwig-Maximilians-Universität München (LMU)
650	Children Acquiring Literacy Naturally	en	childliteracy	[4, 14, 20]	[56]	 Information, Tech & Design + Education + Social Sciences	 University of California, Santa Cruz
651	Cardiac Arrest, Hypothermia, and Resuscitation Science	en	cardiacarrest	[3]	[6]	 Medicine	 University of Pennsylvania
652	Powerful Tools for Teaching and Learning: Web 2.0 Tools	en	newtechtools	[4, 14, 26]	[119]	 Information, Tech & Design + Education + Teacher Professional Development	 University of Houston System
653	Rationing and Allocating Scarce Medical Resources	en	rationing	[8]	[6]	 Health & Society	 University of Pennsylvania
654	Economic Growth and Distributive Justice	en	ecojustice	[2, 13, 21]	[110]	 Economics & Finance + Business & Management + Law	 Tel Aviv University
655	The Role of the Renminbi in the International Monetary System 	en	renminbi	[2]	[45]	 Economics & Finance	 The Chinese University of Hong Kong
656	Principles of Public Health	en	publichealth	[3, 8]	[30]	 Medicine + Health & Society	 University of California, Irvine
657	Representing the Professional Athlete	en	sportsagents	[2, 8, 13, 21]	[68]	 Economics & Finance + Health & Society + Business & Management + Law	 Case Western Reserve University
658	Computer Security	en	security	[11]	[1]	 Computer Science: Systems & Security	 Stanford University
659	Основы корпоративных финансов (Fundamentals of Corporate Finance)	ru	corpfin	[2]	[160]	 Economics & Finance	 Higher School of Economics
660	Pre-Calculus	en	precalculus	[5]	[30]	 Mathematics	 University of California, Irvine
661	Music's Big Bang: The Genesis of Rock 'n' Roll	en	musicsbigbang	[18]	[31]	 Music, Film, and Audio	 University of Florida
662	Data Management for Clinical Research	en	datamanagement	[4, 16]	[37]	 Information, Tech & Design + Statistics and Data Analysis	 Vanderbilt University
663	Design: Creation of Artifacts in Society	en	design	[4, 13, 15, 22]	[6]	 Information, Tech & Design + Business & Management + Engineering + Arts	 University of Pennsylvania
664	计算机辅助翻译原理与实践 Principles and Practice of Computer-Aided Translation	zh-cn	catmooc	[4, 12]	[163]	 Information, Tech & Design + Computer Science: Software Engineering	 Peking University
665	Risk and Opportunity: Managing Risk for Development	en	managerisk	[2, 20]	[73]	 Economics & Finance + Social Sciences	 The World Bank Group
666	Visual Perception and the Brain	en	visualpercepbrain	[10]	[7]	 Biology & Life Sciences	 Duke University
667	Sexing the Canvas: Art and Gender	en	sexingthecanvas	[6, 22]	[33]	 Humanities  + Arts	 The University of Melbourne
668	Surviving Disruptive Technologies	en	sdt	[4, 13]	[32]	 Information, Tech & Design + Business & Management	 University of Maryland, College Park
669	Etkili Konuşma (Effective Speaking)	tr	etkilikonusma	[20]	[182]	 Social Sciences	 Koç University
670	Understanding Media by Understanding Google	en	googlemedia	[2, 4, 13]	[54]	 Economics & Finance + Information, Tech & Design + Business & Management	 Northwestern University
671	Villes africaines: Introduction à la planification urbaine / African cities : an introduction to urban planning	fr	villesafricaines	[6, 20]	[16]	 Humanities  + Social Sciences	 École Polytechnique Fédérale de Lausanne
