id	course_name	course_language	course_short_name	categories	universities	categories_name	universities_name
339	Circadian clocks: how rhythms structure life	en	circaclock	[3, 8, 10]	[64]	 Medicine + Health & Society + Biology & Life Sciences	 Ludwig-Maximilians-Universität München (LMU)
340	论文写作与检索（Academic Writing and Research）	zh-cn	legalresearch	[6, 14, 20, 21]	[163]	 Humanities  + Education + Social Sciences + Law	 Peking University
341	普通物理學 - 電磁學、光學及近代物理	zh-tw	genphysem	[9]	[75]	 Physical & Earth Sciences	 National Taiwan University
342	 K-12 Blended & Online Learning	en	k12blendedlearning	[14, 26]	[123]	 Education + Teacher Professional Development	 University System of Georgia
343	Human Evolution: Past and Future	en	humanevolution	[10, 20]	[65]	 Biology & Life Sciences + Social Sciences	 University of Wisconsin–Madison
344	Public Economics	en	publiceconom	[2]	[160]	 Economics & Finance	 Higher School of Economics
345	Global Health: An Interdisciplinary Overview	en	globalhealthoverview	[3, 8]	[49]	 Medicine + Health & Society	 University of Geneva
346	紅樓夢二──母神崇拜(The Red Chamber Dream 2)	zh-tw	rcd2	[6]	[75]	 Humanities 	 National Taiwan University
347	Теория игр (Game Theory)	ru	gt	[2, 5]	[160]	 Economics & Finance + Mathematics	 Higher School of Economics
348	Vaccines	en	vaccines	[3, 8]	[6]	 Medicine + Health & Society	 University of Pennsylvania
349	Introduction to Computational Finance and Financial Econometrics	en	compfinance	[2]	[15]	 Economics & Finance	 University of Washington
350	Introduction to Classical Music	en	introclassicalmusic	[6, 18, 22]	[109]	 Humanities  + Music, Film, and Audio + Arts	 Yale University
351	Accountable Talk®: Conversation that Works	en	accountabletalk	[14, 26]	[36]	 Education + Teacher Professional Development	 University of Pittsburgh
352	Rural Health Nursing	en	ruralnursing	[3, 8]	[120]	 Medicine + Health & Society	 University of New Mexico
353	Analytic Combinatorics	en	ac	[1, 5]	[4]	 Computer Science: Theory + Mathematics	 Princeton University
354	面向对象技术高级课程（The Advanced Object-Oriented Technology）	zh-cn	aoo	[12]	[163]	 Computer Science: Software Engineering	 Peking University
355	Understanding 9/11: Why Did al Qai’da Attack America?	en	911aftermath	[20, 26]	[7]	 Social Sciences + Teacher Professional Development	 Duke University
356	Practical tips to improve Asian American participation in cancer clinical trials	en	clinicaltrials	[3]	[1]	 Medicine	 Stanford University
357	程序设计与算法（大学先修课）	zh-cn	program	[1]	[163]	 Computer Science: Theory	 Peking University
358	Analyzing Global Trends for Business and Society	en	globaltrends	[2, 13, 20]	[6]	 Economics & Finance + Business & Management + Social Sciences	 University of Pennsylvania
359	Graphene and 2-dimensional Materials	en	graphene	[15, 23, 24]	[147]	 Engineering + Physics + Chemistry	 University of Manchester
360	Comparing Genes, Proteins, and Genomes (Bioinformatics III)	en	comparinggenomes	[1, 5, 10, 12]	[53]	 Computer Science: Theory + Mathematics + Biology & Life Sciences + Computer Science: Software Engineering	 University of California, San Diego
361	Modern & Contemporary American Poetry	en	modernpoetry	[6, 22]	[6]	 Humanities  + Arts	 University of Pennsylvania
362	Experimental Genome Science	en	genomescience	[10]	[6]	 Biology & Life Sciences	 University of Pennsylvania
363	Making Better Group Decisions: Voting, Judgement Aggregation and Fair Division	en	votingfairdiv	[2, 5, 6, 17]	[32]	 Economics & Finance + Mathematics + Humanities  + Computer Science: Artificial Intelligence	 University of Maryland, College Park
364	Curanderismo Part 2: Traditional Healing of the Spirit/Energy	en	tradhealingspirit	[3, 6, 8, 19]	[120]	 Medicine + Humanities  + Health & Society + Food and Nutrition	 University of New Mexico
365	Introduction to Computational Arts	en	cdt208	[1, 4, 18, 22]	[117]	 Computer Science: Theory + Information, Tech & Design + Music, Film, and Audio + Arts	 The State University of New York
366	Chemicals and Health	en	chemhealth	[8, 24]	[8]	 Health & Society + Chemistry	 Johns Hopkins University
367	Medical Neuroscience	en	medicalneuro	[3, 10, 26]	[7]	 Medicine + Biology & Life Sciences + Teacher Professional Development	 Duke University
368	Introduction to the Science of Cancer	en	cancer	[3, 8]	[28]	 Medicine + Health & Society	 The Ohio State University
369	The Fiction of Relationship	en	relationship	[6]	[22]	 Humanities 	 Brown University
370	The French Revolution	en	frenchrev	[6, 20]	[33]	 Humanities  + Social Sciences	 The University of Melbourne
371	The Art of Teaching History: A Global Conversation for Secondary Educators 	en	teachinghist	[14, 26]	[13]	 Education + Teacher Professional Development	 Rice University
372	Pluralidades em Português Brasileiro	pt-br	portestrangeiros	[14]	[208]	 Education	 Universidade Estadual de Campinas
373	Algorithms, Part II	en	algs4partII	[1, 12]	[4]	 Computer Science: Theory + Computer Science: Software Engineering	 Princeton University
374	Deafness in the 21st Century	en	deafness	[8, 14]	[147]	 Health & Society + Education	 University of Manchester
375	Tropical Parasitology: Protozoans, Worms, Vectors and Human Diseases	en	parasitology	[3, 8]	[7, 245]	 Medicine + Health & Society	 Duke University
376	Introduction to Databases	en	db	[11, 12]	[1]	 Computer Science: Systems & Security + Computer Science: Software Engineering	 Stanford University
377	Structural Equation Model and its Applications | 结构方程模型及其应用	zh-cn	sem	[14, 16, 20]	[45]	 Education + Statistics and Data Analysis + Social Sciences	 The Chinese University of Hong Kong
378	Interprofessional Healthcare Informatics 	en	newwayhealthcare	[4, 8, 20]	[50]	 Information, Tech & Design + Health & Society + Social Sciences	 University of Minnesota
379	Healthcare Innovation and Entrepreneurship	en	healthcareinnovation	[8, 13]	[7]	 Health & Society + Business & Management	 Duke University
380	Chemistry	en	chemistry1	[24]	[127]	 Chemistry	 University of Kentucky
381	Career 911: Your Future Job in Medicine and Healthcare	en	healthcarejobs	[3, 8, 13, 14]	[54]	 Medicine + Health & Society + Business & Management + Education	 Northwestern University
382	Statistical Thermodynamics: Molecules to Machines	en	stathermo	[15, 23, 24, 25]	[151]	 Engineering + Physics + Chemistry + Energy & Earth Sciences	
383	Introduction aux droits de l’homme	fr	droitshomme	[6, 21]	[49]	 Humanities  + Law	 University of Geneva
384	Cloud Computing Capstone	en	cloudcapstone	[12]	[17]	 Computer Science: Software Engineering	 University of Illinois at Urbana-Champaign
385	From Nand to Tetris / Part I	en	nand2tetris1	[11, 12, 15]	[24]	 Computer Science: Systems & Security + Computer Science: Software Engineering + Engineering	 Hebrew University of Jerusalem
386	Ancient Egypt: A history in six objects	en	ancientegypt	[6]	[147]	 Humanities 	 University of Manchester
387	MRI Fundamentals	en	mrifundamentals	[3, 8, 15]	[178]	 Medicine + Health & Society + Engineering	 Korea Advanced Institute of Science and Technology
388	Le Bien, le Juste, l'Utile. Introduction aux éthiques philosophiques	fr	ethique	[6]	[49]	 Humanities 	 University of Geneva
389	Shaping the Way We Teach English, 1: The Landscape of English Language Teaching	en	shaping1landscape	[14, 26]	[185]	 Education + Teacher Professional Development	
390	Math behind Moneyball	en	mathletics	[5, 13]	[119]	 Mathematics + Business & Management	 University of Houston System
391	Principles of Computing (Part 2)	en	principlescomputing2	[1, 12]	[13]	 Computer Science: Theory + Computer Science: Software Engineering	 Rice University
392	Engineering Life: Synbio, Bioethics & Public Policy	en	synbioethics	[8, 10, 15]	[8]	 Health & Society + Biology & Life Sciences + Engineering	 Johns Hopkins University
393	Fundamentals of Human Nutrition	en	humannutrition	[8, 10, 19]	[31]	 Health & Society + Biology & Life Sciences + Food and Nutrition	 University of Florida
394	Inquiry Science Learning: Perspectives and Practices 3 - Science Content Survey	en	scicontentsurvey	[14, 26]	[13]	 Education + Teacher Professional Development	 Rice University
395	Corporate Finance Essentials	en	corpfinance	[2, 13]	[172]	 Economics & Finance + Business & Management	 IESE Business School
396	Animal Behaviour	en	animalbehav	[10]	[33]	 Biology & Life Sciences	 The University of Melbourne
397	Scientific Humanities	en	sh	[6, 20]	[210]	 Humanities  + Social Sciences	 Sciences Po
398	Programming Mobile Services for Android Handheld Systems: Communication	en	posacommunication	[4, 11, 12]	[37]	 Information, Tech & Design + Computer Science: Systems & Security + Computer Science: Software Engineering	 Vanderbilt University
399	Logic: Language and Information 1	en	logic1	[1, 5, 6, 15, 22]	[33]	 Computer Science: Theory + Mathematics + Humanities  + Engineering + Arts	 The University of Melbourne
400	Galaxies and Cosmology	en	cosmo	[23]	[12]	 Physics	 Caltech
401	Introduction to Cataract Surgery	en	cataractsurgery	[3, 8]	[3]	 Medicine + Health & Society	 University of Michigan
402	Fundamentals of Electrical Engineering Laboratory	en	eefunlab	[15]	[13]	 Engineering	 Rice University
403	University Teaching 101	en	univteaching101	[6, 14, 20, 26]	[8]	 Humanities  + Education + Social Sciences + Teacher Professional Development	 Johns Hopkins University
404	Философия культуры (Philosophy of Culture)	ru	philculture	[6]	[160]	 Humanities 	 Higher School of Economics
405	Cybersecurity Capstone Project	en	cybersecuritycapstone	[11]	[32]	 Computer Science: Systems & Security	 University of Maryland, College Park
406	Text Retrieval and Search Engines	en	textretrieval	[4, 16, 17]	[17]	 Information, Tech & Design + Statistics and Data Analysis + Computer Science: Artificial Intelligence	 University of Illinois at Urbana-Champaign
407	Information and Communication Technology (ICT) Accessibility 	en	digitalaccessibility	[4, 6, 14]	[9]	 Information, Tech & Design + Humanities  + Education	 Georgia Institute of Technology
408	Natural Language Processing	en	nlp	[17]	[1]	 Computer Science: Artificial Intelligence	 Stanford University
409	English Common Law: Structure and Principles	en	engcomlaw	[6, 21]	[26]	 Humanities  + Law	 University of London
410	Bitcoin and Cryptocurrency Technologies	en	bitcointech	[11]	[4]	 Computer Science: Systems & Security	 Princeton University
411	Introduction to Forensic Science	en	ntufsc	[10, 24]	[121]	 Biology & Life Sciences + Chemistry	 Nanyang Technological University, Singapore
412	Power Onboarding	en	poweronboarding	[13]	[54]	 Business & Management	 Northwestern University
413	機率 (Probability)	zh-tw	prob	[5, 15]	[75]	 Mathematics + Engineering	 National Taiwan University
414	Finding Hidden Messages in DNA (Bioinformatics I)	en	hiddenmessages	[1, 5, 10, 12]	[53]	 Computer Science: Theory + Mathematics + Biology & Life Sciences + Computer Science: Software Engineering	 University of California, San Diego
415	操作系统原理（Operating Systems）	zh-cn	os	[11]	[163]	 Computer Science: Systems & Security	 Peking University
416	Healthcare Data Visualization	en	healthdatavisual	[3, 15]	[9]	 Medicine + Engineering	 Georgia Institute of Technology
417	Intermediate Algebra	en	algebra	[5]	[30]	 Mathematics	 University of California, Irvine
418	Science, Technology, and Society in China III: The Present & Policy Implications	en	stschina3	[20]	[35]	 Social Sciences	 The Hong Kong University of Science and Technology
419	程序设计实习 / Practice on Programming	zh-cn	pkupop	[12]	[163]	 Computer Science: Software Engineering	 Peking University
420	Dino 101: Dinosaur Paleobiology	en	dino101	[9, 10]	[146]	 Physical & Earth Sciences + Biology & Life Sciences	 University of Alberta
421	Approche pluridisciplinaire du dopage	fr	dopage	[8, 20]	[159]	 Health & Society + Social Sciences	 University of Lausanne
422	Understanding China, 1700-2000: A Data Analytic Approach, Part 2	en	newchinahistory2	[6, 20]	[35]	 Humanities  + Social Sciences	 The Hong Kong University of Science and Technology
423	How Green Is That Product? An Introduction to Life Cycle Environmental Assessment	en	introtolca	[15, 16, 25]	[54]	 Engineering + Statistics and Data Analysis + Energy & Earth Sciences	 Northwestern University
424	From the Repertoire: Western Music History through Performance	en	musichistoryperforms	[6, 18]	[79]	 Humanities  + Music, Film, and Audio	 Curtis Institute of Music
425	Latin American Migration	en	latinmigration	[20]	[28]	 Social Sciences	 The Ohio State University
426	Spacebooks. An Introduction To Extraterrestrial Literature	en	spacebooks	[6, 18]	[93]	 Humanities  + Music, Film, and Audio	 University of Zurich
427	Computational Molecular Evolution	en	molevol	[10, 16]	[57]	 Biology & Life Sciences + Statistics and Data Analysis	 Technical University of Denmark (DTU)
428	Content Strategy for Professionals 2: Expanding Your Content’s Impact and Reach	en	growingaudiences	[4, 13]	[54]	 Information, Tech & Design + Business & Management	 Northwestern University
429	Information Security and Risk Management in Context	en	inforiskman	[4, 11, 13]	[15]	 Information, Tech & Design + Computer Science: Systems & Security + Business & Management	 University of Washington
430	Introduction to Chemistry:  Structures and Solutions	en	chem992	[9, 24, 26]	[7]	 Physical & Earth Sciences + Chemistry + Teacher Professional Development	 Duke University
431	Sports and Building Aerodynamics	en	spobuildaerodynamics	[4, 15, 23]	[177]	 Information, Tech & Design + Engineering + Physics	 Eindhoven University of Technology
432	Emerging Trends & Technologies in the Virtual K-12 Classroom	en	k12virtualtrends	[4, 14, 26]	[30]	 Information, Tech & Design + Education + Teacher Professional Development	 University of California, Irvine
433	An Introduction to Interactive Programming in Python (Part 2)	en	interactivepython2	[12]	[13]	 Computer Science: Software Engineering	 Rice University
434	Analytical Chemistry / Instrumental Analysis	en	analyticalchem	[24]	[13]	 Chemistry	 Rice University
435	Learn to Program: Crafting Quality Code	en	programming2	[12]	[11]	 Computer Science: Software Engineering	 University of Toronto
436	Sustainable Agricultural Land Management	en	sustainableag	[13, 19]	[31]	 Business & Management + Food and Nutrition	 University of Florida
437	GPS: An Introduction to Satellite Navigation, with an interactive Worldwide Laboratory using Smartphones	en	gpslab	[9, 15]	[1]	 Physical & Earth Sciences + Engineering	 Stanford University
438	Core Concepts in Data Analysis	en	datan	[16]	[160]	 Statistics and Data Analysis	 Higher School of Economics
439	Introduction to Household Water Treatment and Safe Storage	en	hwts	[]	[16]		 École Polytechnique Fédérale de Lausanne
440	Экономика для неэкономистов (Economics for non-economists)	ru	ecnonec	[2]	[160]	 Economics & Finance	 Higher School of Economics
441	The Changing Global Order	en	globalorder	[6, 20, 21]	[25, 49]	 Humanities  + Social Sciences + Law	 Universiteit Leiden + University of Geneva
442	Coding the Matrix: Linear Algebra through Computer Science Applications	en	matrix	[1, 5, 16, 17]	[22]	 Computer Science: Theory + Mathematics + Statistics and Data Analysis + Computer Science: Artificial Intelligence	 Brown University
443	Emergence of Life	en	emergenceoflife	[9, 10]	[17]	 Physical & Earth Sciences + Biology & Life Sciences	 University of Illinois at Urbana-Champaign
444	Software Security 	en	softwaresec	[11]	[32]	 Computer Science: Systems & Security	 University of Maryland, College Park
445	Analyzing the Universe	en	analyze	[23]	[67]	 Physics	 Rutgers the State University of New Jersey
446	数学之旅 The Journey of Mathematics	zh-cn	sjtuma153	[5]	[150]	 Mathematics	 Shanghai Jiao Tong University
447	VLSI CAD:  Logic to Layout	en	vlsicad	[11, 15]	[17]	 Computer Science: Systems & Security + Engineering	 University of Illinois at Urbana-Champaign
448	Assessment and Teaching of 21st Century Skills	en	atc21s	[14, 26]	[33]	 Education + Teacher Professional Development	 The University of Melbourne
449	Genomic and Precision Medicine	en	genomicmedicine	[3]	[10]	 Medicine	 University of California, San Francisco
450	Social Psychology	en	socialpsychology	[8, 13, 14, 20, 26]	[34]	 Health & Society + Business & Management + Education + Social Sciences + Teacher Professional Development	 Wesleyan University
451	中國古代歷史與人物－－秦始皇	zh-tw	chinesehistory	[6]	[75]	 Humanities 	 National Taiwan University
452	Linear and Discrete Optimization	en	linearopt	[1, 5]	[16]	 Computer Science: Theory + Mathematics	 École Polytechnique Fédérale de Lausanne
453	Social and Economic Networks:  Models and Analysis	en	networksonline	[1, 2, 5, 16, 20]	[1]	 Computer Science: Theory + Economics & Finance + Mathematics + Statistics and Data Analysis + Social Sciences	 Stanford University
454	Scaling operations: Linking strategy and execution	en	scalingoperations	[2, 13, 16]	[54]	 Economics & Finance + Business & Management + Statistics and Data Analysis	 Northwestern University
455	Interactive Computer Graphics with WebGL	en	webgl	[4, 12]	[120]	 Information, Tech & Design + Computer Science: Software Engineering	 University of New Mexico
456	Big Data Science with the BD2K-LINCS Data Coordination and Integration Center	en	bd2klincs	[3, 5, 10, 16, 17]	[27]	 Medicine + Mathematics + Biology & Life Sciences + Statistics and Data Analysis + Computer Science: Artificial Intelligence	 Icahn School of Medicine at Mount Sinai
457	Probabilistic Graphical Models	en	pgm	[17]	[1]	 Computer Science: Artificial Intelligence	 Stanford University
458	Enhance Your Career and Employability Skills	en	career	[1, 2, 3, 4, 5, 6, 8, 9, 10, 11, 12, 13, 14, 15, 16, 17, 18, 19, 20, 21, 22, 23, 24, 25, 26]	[26]	 Computer Science: Theory + Economics & Finance + Medicine + Information, Tech & Design + Mathematics + Humanities  + Health & Society + Physical & Earth Sciences + Biology & Life Sciences + Computer Science: Systems & Security + Computer Science: Software Engineering + Business & Management + Education + Engineering + Statistics and Data Analysis + Computer Science: Artificial Intelligence + Music, Film, and Audio + Food and Nutrition + Social Sciences + Law + Arts + Physics + Chemistry + Energy & Earth Sciences + Teacher Professional Development	 University of London
459	Introduction to Acoustics (Part 1)	en	acoustics1	[15, 18, 23]	[178]	 Engineering + Music, Film, and Audio + Physics	 Korea Advanced Institute of Science and Technology
460	Chicken Behaviour and Welfare	en	chickens	[10, 19]	[14]	 Biology & Life Sciences + Food and Nutrition	 The University of Edinburgh
461	Initiation à la théorie des distributions	fr	distributions	[5]	[66]	 Mathematics	 École Polytechnique
462	The Social Context of Mental Health and Illness	en	mentalhealth	[8]	[11]	 Health & Society	 University of Toronto
463	Women and the Civil Rights Movement	en	womencivilrights	[6]	[32]	 Humanities 	 University of Maryland, College Park
464	The Caltech-JPL Summer School on Big Data Analytics	en	bigdataschool	[16]	[12]	 Statistics and Data Analysis	 Caltech
465	Fundamentals of Pharmacology	en	pharm101	[3]	[6]	 Medicine	 University of Pennsylvania
466	Geodesign: Change Your World	en	geodesign	[4, 9, 25]	[51]	 Information, Tech & Design + Physical & Earth Sciences + Energy & Earth Sciences	 The Pennsylvania State University
467	American Education Reform: History, Policy, Practice	en	edref	[6, 14, 20]	[6]	 Humanities  + Education + Social Sciences	 University of Pennsylvania
468	Preparing for the AP* Calculus AB and BC Exams (Part 1 - Differential Calculus)	en	apcalcpart1	[5]	[119]	 Mathematics	 University of Houston System
469	History and Future of (Mostly) Higher Education	en	highered	[4, 6, 14, 20, 26]	[7]	 Information, Tech & Design + Humanities  + Education + Social Sciences + Teacher Professional Development	 Duke University
470	Teaching Statistical Thinking: Part 1 Descriptive Statistics	en	teachstats1	[14, 16, 26]	[7]	 Education + Statistics and Data Analysis + Teacher Professional Development	 Duke University
471	Statistics for Genomic Data Science	en	genstats	[4, 9, 10, 16]	[8]	 Information, Tech & Design + Physical & Earth Sciences + Biology & Life Sciences + Statistics and Data Analysis	 Johns Hopkins University
472	Applied Logistic Regression	en	logisticregression	[2, 3, 4, 5, 8, 16]	[28]	 Economics & Finance + Medicine + Information, Tech & Design + Mathematics + Health & Society + Statistics and Data Analysis	 The Ohio State University
473	Initiation à la programmation (en Java)	fr	initprogjava	[12]	[16]	 Computer Science: Software Engineering	 École Polytechnique Fédérale de Lausanne
474	Video Games and Learning	en	videogameslearning	[4, 14]	[65]	 Information, Tech & Design + Education	 University of Wisconsin–Madison
475	The Clinical Psychology of Children and Young People	en	clinicalpsych	[3, 8, 10, 20, 26]	[14]	 Medicine + Health & Society + Biology & Life Sciences + Social Sciences + Teacher Professional Development	 The University of Edinburgh
476	Sleep: Neurobiology, Medicine, and Society	en	sleep	[3, 8, 10]	[3]	 Medicine + Health & Society + Biology & Life Sciences	 University of Michigan
477	Nutrition and Physical Activity for Health	en	nutritionforhealth	[14, 19]	[36]	 Education + Food and Nutrition	 University of Pittsburgh
478	The Fundamentals of Computing Specialization Capstone Exam	en	foccapstone2	[1, 12]	[13]	 Computer Science: Theory + Computer Science: Software Engineering	 Rice University
479	Sustainability in Practice	en	sustaininprac	[4, 6, 13, 20, 25]	[6]	 Information, Tech & Design + Humanities  + Business & Management + Social Sciences + Energy & Earth Sciences	 University of Pennsylvania
480	Understanding Video Games	en	uvg	[4, 6, 18, 22]	[146]	 Information, Tech & Design + Humanities  + Music, Film, and Audio + Arts	 University of Alberta
481	Introduction to Computational Arts: Audio	en	compartsaudio	[18]	[117]	 Music, Film, and Audio	 The State University of New York
482	市场营销概论 (中文版）	zh-cn	whartonmarketingzh	[13]	[6]	 Business & Management	 University of Pennsylvania
483	Physics 1 for Physical Science Majors	en	physics1	[23]	[71, 126]	 Physics	 University of Colorado Boulder + University of Colorado System
484	Performance Assessment in the Virtual Classroom	en	virtualassessment	[14]	[30]	 Education	 University of California, Irvine
485	Discrete Inference and Learning in Artificial Vision	en	artificialvision	[17]	[128]	 Computer Science: Artificial Intelligence	 CentraleSupélec
486	Molecular Evolution (Bioinformatics IV)	en	molecularevolution	[1, 4, 5, 10, 12]	[53]	 Computer Science: Theory + Information, Tech & Design + Mathematics + Biology & Life Sciences + Computer Science: Software Engineering	 University of California, San Diego
487	Preparing for the AP Physics 1 Exam	en	apphysics1	[23]	[119]	 Physics	 University of Houston System
488	Virtual Teacher Final Project	en	vtfinalproject	[14]	[30]	 Education	 University of California, Irvine
489	Введение в российское налоговое право (Introduction to the Russian Tax Law)	ru	taxlaw	[2, 21]	[160]	 Economics & Finance + Law	 Higher School of Economics
490	Innovación educativa con recursos abiertos	es	innovacionrea	[14]	[62]	 Education	 Tecnológico de Monterrey
491	The Art and Archaeology of Ancient Nubia	en	ancientnubia	[6, 20, 22]	[23]	 Humanities  + Social Sciences + Arts	 Emory University
492	Web Intelligence and Big Data	en	bigdata	[17]	[19]	 Computer Science: Artificial Intelligence	
493	Curanderismo Part 1: Traditional Healing of the Body	en	tradhealingbody	[3, 6, 8, 19]	[120]	 Medicine + Humanities  + Health & Society + Food and Nutrition	 University of New Mexico
494	Powerful Tools for Teaching and Learning: Digital Storytelling	en	digitalstorytelling	[4, 14, 26]	[119]	 Information, Tech & Design + Education + Teacher Professional Development	 University of Houston System
495	Pattern Discovery in Data Mining	en	patterndiscovery	[4, 12, 16]	[17]	 Information, Tech & Design + Computer Science: Software Engineering + Statistics and Data Analysis	 University of Illinois at Urbana-Champaign
496	Networks: Friends, Money, and Bytes	en	friendsmoneybytes	[2, 4, 11]	[4]	 Economics & Finance + Information, Tech & Design + Computer Science: Systems & Security	 Princeton University
497	L'art des structures 1 : Câbles et arcs	fr	structures	[15]	[16]	 Engineering	 École Polytechnique Fédérale de Lausanne
498	Living with Dementia: Impact on Individuals, Caregivers, Communities and Societies	en	dementiacare	[3, 8, 20]	[8]	 Medicine + Health & Society + Social Sciences	 Johns Hopkins University
499	Data Analysis and Statistical Inference 	en	statistics	[16, 26]	[7]	 Statistics and Data Analysis + Teacher Professional Development	 Duke University
500	Common Core in Action: Math Classroom Challenges- Using Formative Assessment to Guide Instruction	en	ccss-math1	[5, 14, 26]	[103]	 Mathematics + Education + Teacher Professional Development	 New Teacher Center
501	電磁學(Electromagnetics)	zh-tw	ntuem	[9]	[75]	 Physical & Earth Sciences	 National Taiwan University
502	Cracking the Creativity Code: Part 1- Discovering Ideas	en	creativity	[2, 4, 13, 15, 20]	[129]	 Economics & Finance + Information, Tech & Design + Business & Management + Engineering + Social Sciences	 Technion - Israel Institute of Technology
503	Inquiry Science Learning: Perspectives & Practices 4 - Student-Centered Inquiry	en	scistudentinquiry	[14, 26]	[13]	 Education + Teacher Professional Development	 Rice University
