id	course_name	course_language	course_short_name	categories	universities	categories_name	universities_name
169	Statistical Reasoning for Public Health 2: Regression Methods	en	statreasoning2	[5, 8, 10]	[8]	 Mathematics + Health & Society + Biology & Life Sciences	 Johns Hopkins University
170	Major Depression in the Population: A Public Health Approach	en	pmhdepression	[3, 8]	[8]	 Medicine + Health & Society	 Johns Hopkins University
171	沃顿商务基础毕业项目（中文版）	zh-cn	whartoncapstonezh	[2, 13]	[6]	 Economics & Finance + Business & Management	 University of Pennsylvania
172	Resilience in Children Exposed to Trauma, Disaster and War: Global Perspectives	en	resilienceinchildren	[8, 14, 20]	[50]	 Health & Society + Education + Social Sciences	 University of Minnesota
173	Economics of Money and Banking, Part One	en	money	[2]	[40]	 Economics & Finance	 Columbia University
174	流行病学基础（上）	zh-cn	bjmuepiabc	[3, 8]	[163]	 Medicine + Health & Society	 Peking University
175	工程圖學2D	zh-tw	graph	[4, 15, 22]	[75]	 Information, Tech & Design + Engineering + Arts	 National Taiwan University
176	算法设计与分析   Design and Analysis of Algorithms	zh-cn	algorithms	[1]	[163]	 Computer Science: Theory	 Peking University
177	唐诗宋词人文解读 Appreciation of Tang and Song Poetry	zh-cn	sjtuch902	[6]	[150]	 Humanities 	 Shanghai Jiao Tong University
178	Introduction to Light, Color, and Life	en	lcl	[4, 9, 10]	[178]	 Information, Tech & Design + Physical & Earth Sciences + Biology & Life Sciences	 Korea Advanced Institute of Science and Technology
179	Functional Programming Principles in Scala	en	progfun	[12]	[16]	 Computer Science: Software Engineering	 École Polytechnique Fédérale de Lausanne
180	Why We Need Psychology	en	needpsych	[6]	[26]	 Humanities 	 University of London
181	Auf Deutsch: Communicating in German Across Cultures 	en	deutsch	[6, 14, 20]	[6]	 Humanities  + Education + Social Sciences	 University of Pennsylvania
182	Markets with Frictions	en	marketswithfrictions	[2, 13]	[65]	 Economics & Finance + Business & Management	 University of Wisconsin–Madison
183	Psychology of Popularity	en	popularity	[1, 2, 3, 4, 5, 6, 8, 9, 10, 11, 12, 13, 14, 15, 16, 17, 18, 19, 20, 21, 22, 23, 24, 25, 26]	[77]	 Computer Science: Theory + Economics & Finance + Medicine + Information, Tech & Design + Mathematics + Humanities  + Health & Society + Physical & Earth Sciences + Biology & Life Sciences + Computer Science: Systems & Security + Computer Science: Software Engineering + Business & Management + Education + Engineering + Statistics and Data Analysis + Computer Science: Artificial Intelligence + Music, Film, and Audio + Food and Nutrition + Social Sciences + Law + Arts + Physics + Chemistry + Energy & Earth Sciences + Teacher Professional Development	 The University of North Carolina at Chapel Hill
184	The Science of Safety in Healthcare	en	healthcaresafety	[3, 8]	[8]	 Medicine + Health & Society	 Johns Hopkins University
185	Community Change in Public Health	en	communitychange	[8]	[8]	 Health & Society	 Johns Hopkins University
186	Feeding the World	en	feedingtheworld	[2, 8, 10, 19]	[6]	 Economics & Finance + Health & Society + Biology & Life Sciences + Food and Nutrition	 University of Pennsylvania
187	Ethical and Social Challenges of Genomic and Precision Medicine	en	ethicalsocialgenomic	[3, 8]	[10]	 Medicine + Health & Society	 University of California, San Francisco
188	Introduction to Statistics for the Social Sciences	en	statistics101	[5, 16, 20]	[93]	 Mathematics + Statistics and Data Analysis + Social Sciences	 University of Zurich
189	Software Defined Networking	en	sdn1	[11, 12]	[4]	 Computer Science: Systems & Security + Computer Science: Software Engineering	 Princeton University
190	Introductory Physics I with Laboratory	en	phys1	[9, 15, 23, 26]	[9]	 Physical & Earth Sciences + Engineering + Physics + Teacher Professional Development	 Georgia Institute of Technology
191	20世纪西方音乐 Western Music in the 20th Century	zh-cn	20cnwm	[6, 18, 22]	[163]	 Humanities  + Music, Film, and Audio + Arts	 Peking University
192	Learn to Program: The Fundamentals	en	programming1	[12]	[11]	 Computer Science: Software Engineering	 University of Toronto
193	Social Epidemiology	en	socialepi	[8, 20]	[50]	 Health & Society + Social Sciences	 University of Minnesota
194	Programming Languages	en	proglang	[12]	[15]	 Computer Science: Software Engineering	 University of Washington
195	Foundations of Virtual Instruction	en	virtualinstruction	[4, 14, 26]	[30]	 Information, Tech & Design + Education + Teacher Professional Development	 University of California, Irvine
196	Roman Architecture	en	romanarchitecture	[6, 22]	[109]	 Humanities  + Arts	 Yale University
197	ICT in Primary Education: Transforming children's learning across the curriculum	en	ictinprimary	[14, 26]	[26]	 Education + Teacher Professional Development	 University of London
198	Citizenship and U.S. Immigration	en	immigration	[6, 21]	[23]	 Humanities  + Law	 Emory University
199	Chinese Characters for beginner 汉字	zh-cn	chinesecharacters	[6]	[163]	 Humanities 	 Peking University
200	Unethical Decision Making in Organizations	en	unethicaldecision	[6, 13, 20]	[159]	 Humanities  + Business & Management + Social Sciences	 University of Lausanne
201	Shaping the Way We Teach English, 2: Paths to Success in ELT	en	shaping2paths	[14, 26]	[185]	 Education + Teacher Professional Development	
202	Cloud Computing Applications	en	cloudapplications	[4, 11, 12]	[17]	 Information, Tech & Design + Computer Science: Systems & Security + Computer Science: Software Engineering	 University of Illinois at Urbana-Champaign
203	Scientific Computing	en	scientificcomp	[5, 16]	[15]	 Mathematics + Statistics and Data Analysis	 University of Washington
204	紅樓夢(The Red Chamber Dream)	zh-tw	rcd	[6]	[75]	 Humanities 	 National Taiwan University
205	Photography: A Victorian Sensation	en	vicphoto	[6, 14, 18, 22]	[14]	 Humanities  + Education + Music, Film, and Audio + Arts	 The University of Edinburgh
206	史記（一）（Shi-ji (1) ）	zh-tw	shiji	[6]	[75]	 Humanities 	 National Taiwan University
207	Introduction to Recommender Systems	en	recsys	[4, 13, 17]	[50]	 Information, Tech & Design + Business & Management + Computer Science: Artificial Intelligence	 University of Minnesota
208	刑法学总论 Criminal Law	zh-cn	criminallaw	[21]	[163]	 Law	 Peking University
209	Model Thinking 模型思维（中文版）	zh-cn	modelthinkingzh	[2, 6, 20]	[3]	 Economics & Finance + Humanities  + Social Sciences	 University of Michigan
210	Bajemos la temperatura - Por qué se debe evitar un planeta 4°C más cálido	es	bajemostemperatura	[9, 25]	[73]	 Physical & Earth Sciences + Energy & Earth Sciences	 The World Bank Group
211	Water: The Essential Resource	en	waterandenvironment	[14, 26]	[154]	 Education + Teacher Professional Development	 National Geographic Society
212	Turn Down the Heat: Why a 4°C Warmer World Must be Avoided	en	warmerworld	[9, 25]	[73]	 Physical & Earth Sciences + Energy & Earth Sciences	 The World Bank Group
213	Теория отраслевых рынков (Industrial Organization)	ru	industorg	[2]	[160]	 Economics & Finance	 Higher School of Economics
214	Listening to World Music	en	worldmusic	[6, 18, 20]	[6]	 Humanities  + Music, Film, and Audio + Social Sciences	 University of Pennsylvania
215	Social Network Analysis	en	sna	[4, 17]	[3]	 Information, Tech & Design + Computer Science: Artificial Intelligence	 University of Michigan
216	Science, Technology, and Society in China II: History of S&T in Chinese Society	en	stschina2	[20]	[35]	 Social Sciences	 The Hong Kong University of Science and Technology
217	Origens da Vida no Contexto Cósmico	pt-br	origensdavida	[9, 23]	[221]	 Physical & Earth Sciences + Physics	 Universidade de São Paulo
218	Planning & Design of Sanitation Systems and Technologies 	en	sanitation	[8, 20]	[16]	 Health & Society + Social Sciences	 École Polytechnique Fédérale de Lausanne
219	General Game Playing	en	ggp	[1, 5, 17]	[1]	 Computer Science: Theory + Mathematics + Computer Science: Artificial Intelligence	 Stanford University
220	Aboriginal Worldviews and Education	en	aboriginaled	[6, 14]	[11]	 Humanities  + Education	 University of Toronto
221	Generation Rx: The Science Behind Prescription Drug Abuse	en	genrx	[3, 8]	[28]	 Medicine + Health & Society	 The Ohio State University
222	Information Theory	en	informationtheory	[4]	[45]	 Information, Tech & Design	 The Chinese University of Hong Kong
223	Case-Based Introduction to Biostatistics	en	casebasedbiostat	[8, 16]	[8]	 Health & Society + Statistics and Data Analysis	 Johns Hopkins University
224	Planet Earth...and You!	en	earth	[9, 25]	[17]	 Physical & Earth Sciences + Energy & Earth Sciences	 University of Illinois at Urbana-Champaign
225	Analysis of a Complex Kind	en	complexanalysis	[5]	[34]	 Mathematics	 Wesleyan University
226	Human-Computer Interaction Design	en	hcidesign	[4, 12]	[53]	 Information, Tech & Design + Computer Science: Software Engineering	 University of California, San Diego
227	Health Policy and the Affordable Care Act	en	healthpolicy	[2, 8]	[6]	 Economics & Finance + Health & Society	 University of Pennsylvania
228	离散数学概论 Discrete Mathematics Generality	zh-cn	dmathgen	[1, 5]	[163]	 Computer Science: Theory + Mathematics	 Peking University
229	Exploring Neural Data	en	neuraldata	[10, 16]	[22]	 Biology & Life Sciences + Statistics and Data Analysis	 Brown University
230	Early Renaissance Architecture in Italy: from Alberti to Bramante	en	renaissancearchitect	[6, 22]	[74]	 Humanities  + Arts	 Sapienza University of Rome
231	Leading Strategic Innovation in Organizations	en	innovation	[13]	[37]	 Business & Management	 Vanderbilt University
232	Principles of Computing (Part 1)	en	principlescomputing1	[1, 12]	[13]	 Computer Science: Theory + Computer Science: Software Engineering	 Rice University
233	Diabetes: Diagnosis, Treatment, and Opportunities	en	ucsfdiabetes	[3, 8]	[10]	 Medicine + Health & Society	 University of California, San Francisco
234	The Diversity of Exoplanets	en	extrasolarplanets	[23]	[49]	 Physics	 University of Geneva
235	Probability	en	probability	[2, 5, 15, 16, 20]	[6]	 Economics & Finance + Mathematics + Engineering + Statistics and Data Analysis + Social Sciences	 University of Pennsylvania
236	Clinical Problem Solving	en	clinprobsolv	[3]	[10]	 Medicine	 University of California, San Francisco
237	Cities are back in town : urban sociology for a globalizing urban world 	en	cities	[6, 20]	[210]	 Humanities  + Social Sciences	 Sciences Po
238	Sprachtechnologie in den Digital Humanities	de	langtechindh	[6, 16, 17]	[93]	 Humanities  + Statistics and Data Analysis + Computer Science: Artificial Intelligence	 University of Zurich
239	An Exploration of Symmetry (Eligible for NTU Credit)	en	ntusym	[9, 10, 22, 24]	[121]	 Physical & Earth Sciences + Biology & Life Sciences + Arts + Chemistry	 Nanyang Technological University, Singapore
240	University of Illinois iMBA Program	en	imba	[13]	[17]	 Business & Management	 University of Illinois at Urbana-Champaign
241	Introducción a las Finanzas Corporativas	es	whartonfinancees	[13]	[6]	 Business & Management	 University of Pennsylvania
242	Computational Neuroscience	en	compneuro	[3, 5, 10, 15, 16, 17]	[15]	 Medicine + Mathematics + Biology & Life Sciences + Engineering + Statistics and Data Analysis + Computer Science: Artificial Intelligence	 University of Washington
243	Statistics: Making Sense of Data	en	introstats	[16]	[11]	 Statistics and Data Analysis	 University of Toronto
244	Sustainable Food Production Through Livestock Health Management	en	sustainablefood	[2, 3, 8, 10, 13, 19]	[17]	 Economics & Finance + Medicine + Health & Society + Biology & Life Sciences + Business & Management + Food and Nutrition	 University of Illinois at Urbana-Champaign
245	Liderazgo en gestión educativa estratégica a través del uso de la tecnología	es	lidergestionedu	[26]	[62]	 Teacher Professional Development	 Tecnológico de Monterrey
246	Claves para Gestionar Personas	es	gestionpersonas	[13, 20]	[172]	 Business & Management + Social Sciences	 IESE Business School
247	La visione del mondo della Relatività e della Meccanica Quantistica	it	rqm	[6, 23]	[74]	 Humanities  + Physics	 Sapienza University of Rome
248	Finding Mutations in DNA and Proteins (Bioinformatics VI)	en	mutations	[1, 4, 5, 10, 12]	[53]	 Computer Science: Theory + Information, Tech & Design + Mathematics + Biology & Life Sciences + Computer Science: Software Engineering	 University of California, San Diego
249	The Brain and Space	en	brainspace	[10, 26]	[7]	 Biology & Life Sciences + Teacher Professional Development	 Duke University
250	Configuring the World: A Critical Political Economy Approach	en	configuringworld	[2, 6, 20]	[25, 49]	 Economics & Finance + Humanities  + Social Sciences	 Universiteit Leiden + University of Geneva
251	Pattern-Oriented Software Architectures for Concurrent and Networked Software	en	posasoftware	[]	[37]		 Vanderbilt University
252	数据结构与算法  Data Structures and Algorithms	zh-cn	dsalgo	[1]	[163]	 Computer Science: Theory	 Peking University
253	Virology I: How Viruses Work	en	virology	[3, 10]	[40]	 Medicine + Biology & Life Sciences	 Columbia University
254	東亞儒學─孟子：1 (East Asian Confucianisms: Mencius 1)	zh-tw	mencius1	[6]	[75]	 Humanities 	 National Taiwan University
255	Cluster Analysis in Data Mining	en	clusteranalysis	[4, 12, 16]	[17]	 Information, Tech & Design + Computer Science: Software Engineering + Statistics and Data Analysis	 University of Illinois at Urbana-Champaign
256	Mental Health: A Global Priority	en	mhglobal	[3, 8]	[14]	 Medicine + Health & Society	 The University of Edinburgh
257	Introduction to Systems Engineering	en	introse	[4, 13, 15]	[155]	 Information, Tech & Design + Business & Management + Engineering	 UNSW Australia (The University of New South Wales)
258	Designing Technology for Learning	en	designtech4learning	[4, 15]	[9]	 Information, Tech & Design + Engineering	 Georgia Institute of Technology
259	Web Application Architectures	en	webapplications	[4, 12, 15]	[120]	 Information, Tech & Design + Computer Science: Software Engineering + Engineering	 University of New Mexico
260	Pathways to climate change adaptation: the case of Small Island Developing States	en	sids	[8, 9, 14, 20, 25]	[49]	 Health & Society + Physical & Earth Sciences + Education + Social Sciences + Energy & Earth Sciences	 University of Geneva
261	Les problèmes métaphysiques à l’épreuve de la politique, 1943-1968	fr	philofrancaise	[6]	[130]	 Humanities 	 École normale supérieure
262	软件包在流行病学研究中的应用 Using software apps in epidemiological research	zh-cn	epiapps	[16]	[163]	 Statistics and Data Analysis	 Peking University
263	Chinese Politics Part 2 – China and the World	en	chinesepolitics2	[6, 20]	[35]	 Humanities  + Social Sciences	 The Hong Kong University of Science and Technology
264	Cryptography I	en	crypto	[1, 11]	[1]	 Computer Science: Theory + Computer Science: Systems & Security	 Stanford University
265	The American Disease: Drugs and Drug Control in the USA	en	americandisease	[3, 8]	[31]	 Medicine + Health & Society	 University of Florida
266	Practical Ethics	en	practicalethics	[6]	[4]	 Humanities 	 Princeton University
267	Passion Driven Statistics	en	pdstatistics	[16]	[34]	 Statistics and Data Analysis	 Wesleyan University
268	Gestion des aires protégées en Afrique	fr	apafrique	[6, 10]	[16]	 Humanities  + Biology & Life Sciences	 École Polytechnique Fédérale de Lausanne
269	Bioelectricity: A Quantitative Approach	en	bioelectricity	[10, 23, 26]	[7]	 Biology & Life Sciences + Physics + Teacher Professional Development	 Duke University
270	Genome Sequencing (Bioinformatics II)	en	assembly	[1, 5, 10, 12]	[53]	 Computer Science: Theory + Mathematics + Biology & Life Sciences + Computer Science: Software Engineering	 University of California, San Diego
271	Understanding and Improving the US Healthcare System	en	ushealthcare	[3, 8]	[3]	 Medicine + Health & Society	 University of Michigan
272	Introduction to Quantum Optics	en	qoptintro	[9, 23]	[64]	 Physical & Earth Sciences + Physics	 Ludwig-Maximilians-Universität München (LMU)
273	Democratic Development	en	democraticdev	[6, 20]	[1]	 Humanities  + Social Sciences	 Stanford University
274	Introduction to Psychology	en	intropsych	[20]	[11]	 Social Sciences	 University of Toronto
275	Process Mining: Data science in Action	en	procmin	[4, 13, 16, 17]	[177]	 Information, Tech & Design + Business & Management + Statistics and Data Analysis + Computer Science: Artificial Intelligence	 Eindhoven University of Technology
276	Understanding Terrorism and the Terrorist Threat	en	understandingterror	[20]	[32]	 Social Sciences	 University of Maryland, College Park
277	Understanding Violence	en	violence	[6, 8, 20]	[23]	 Humanities  + Health & Society + Social Sciences	 Emory University
278	Content Strategy for Professionals 1: Engaging Audiences for Your Organization	en	contentstrategy	[4, 13]	[54]	 Information, Tech & Design + Business & Management	 Northwestern University
279	The Olympic Games and the Media	en	olympicgames	[4, 6, 13, 20]	[80]	 Information, Tech & Design + Humanities  + Business & Management + Social Sciences	 Universitat Autònoma de Barcelona
280	Introduction to Mathematical Thinking	en	maththink	[5]	[1]	 Mathematics	 Stanford University
281	Natural Language Processing	en	nlangp	[17]	[40]	 Computer Science: Artificial Intelligence	 Columbia University
282	Exploring Light	en	explorelight	[9, 10, 14, 23, 24, 26]	[108]	 Physical & Earth Sciences + Biology & Life Sciences + Education + Physics + Chemistry + Teacher Professional Development	 Exploratorium
283	Global Adolescent Health	en	adolescenthealth	[3, 8, 14]	[33]	 Medicine + Health & Society + Education	 The University of Melbourne
284	Neural Networks for Machine Learning	en	neuralnets	[16, 17]	[11]	 Statistics and Data Analysis + Computer Science: Artificial Intelligence	 University of Toronto
285	Linear Circuits	en	circuits	[15]	[9]	 Engineering	 Georgia Institute of Technology
286	The Bible's Prehistory, Purpose, and Political Future	en	biblefuture	[6, 20]	[23]	 Humanities  + Social Sciences	 Emory University
287	First-Year Composition 2.0	en	gtcomp	[6]	[9]	 Humanities 	 Georgia Institute of Technology
288	America Through Foreign Eyes	en	foreigneyes	[6, 20]	[13]	 Humanities  + Social Sciences	 Rice University
289	Global Health and Humanitarianism	en	health	[]	[147]		 University of Manchester
290	Latin American Culture	en	latinamericanculture	[6, 20]	[62]	 Humanities  + Social Sciences	 Tecnológico de Monterrey
291	Foundations of Teaching for Learning 6: Introduction to Student Assessment	en	teach6	[14, 26]	[106]	 Education + Teacher Professional Development	 Commonwealth Education Trust
292	Rédaction de contrats	fr	contrats	[21]	[49]	 Law	 University of Geneva
293	Guinea Pigs, Heroes & Desperate Patients: The History & Ethics of Human Research	en	humanresearch	[3, 6, 8, 10, 20]	[8]	 Medicine + Humanities  + Health & Society + Biology & Life Sciences + Social Sciences	 Johns Hopkins University
294	The Brain-Targeted Teaching® Model for 21st Century Schools	en	braintargeted	[14, 26]	[8]	 Education + Teacher Professional Development	 Johns Hopkins University
295	Comic Books and Graphic Novels	en	comics	[6, 22]	[71, 126]	 Humanities  + Arts	 University of Colorado Boulder + University of Colorado System
296	Applied Regression Analysis	en	appliedregression	[2, 3, 4, 5, 8, 16]	[28]	 Economics & Finance + Medicine + Information, Tech & Design + Mathematics + Health & Society + Statistics and Data Analysis	 The Ohio State University
297	e-Learning Ecologies	en	elearning	[4, 14, 26]	[17]	 Information, Tech & Design + Education + Teacher Professional Development	 University of Illinois at Urbana-Champaign
298	Introducción a la Gestión de Operaciones	es	whartonoperationses	[13]	[6]	 Business & Management	 University of Pennsylvania
299	Inquiry Science Learning: Perspectives and Practices 1 - Science Leadership	en	scileadership	[14, 26]	[13]	 Education + Teacher Professional Development	 Rice University
300	History of the Slave South	en	slavesouth	[6, 20]	[6]	 Humanities  + Social Sciences	 University of Pennsylvania
301	Using The Next Generation Science Standards for Students’ Deeper Understanding 	en	sciframework	[14, 26]	[13]	 Education + Teacher Professional Development	 Rice University
302	Computational Methods for Data Analysis	en	compmethods	[16]	[15]	 Statistics and Data Analysis	 University of Washington
303	Introduction to Computational Arts: Visual Arts	en	compartsvisual	[22]	[117]	 Arts	 The State University of New York
304	Canine Theriogenology for Dog Enthusiasts	en	theriogenology	[3, 8, 10]	[50]	 Medicine + Health & Society + Biology & Life Sciences	 University of Minnesota
305	Hardware Security	en	hardwaresec	[11, 15]	[32]	 Computer Science: Systems & Security + Engineering	 University of Maryland, College Park
306	中国古代文化	zh-cn	pkuacc	[6]	[163]	 Humanities 	 Peking University
307	Epigenetic Control of Gene Expression	en	epigenetics	[3, 10]	[33]	 Medicine + Biology & Life Sciences	 The University of Melbourne
308	Cloud Computing Concepts: Part 2	en	cloudcomputing2	[1, 4, 12, 15]	[17]	 Computer Science: Theory + Information, Tech & Design + Computer Science: Software Engineering + Engineering	 University of Illinois at Urbana-Champaign
309	Preparing for the AP* Calculus AB and BC Exams (Part 2 - Integral Calculus)	en	apcalcpart2	[5]	[119]	 Mathematics	 University of Houston System
310	Introduction to Electronics	en	introtoelectronics	[15]	[9]	 Engineering	 Georgia Institute of Technology
311	Computer Science 101	en	cs101	[12]	[1]	 Computer Science: Software Engineering	 Stanford University
312	Heterogeneous Parallel Programming	en	hetero	[11, 12]	[17]	 Computer Science: Systems & Security + Computer Science: Software Engineering	 University of Illinois at Urbana-Champaign
313	Introduction à la programmation orientée objet (en C++)	fr	intropoocpp	[12]	[16]	 Computer Science: Software Engineering	 École Polytechnique Fédérale de Lausanne
314	Health Leadership	en	healthleadership	[8, 13, 20]	[155]	 Health & Society + Business & Management + Social Sciences	 UNSW Australia (The University of New South Wales)
315	Fantasy and Science Fiction: The Human Mind, Our Modern World	en	fantasysf	[6]	[3]	 Humanities 	 University of Michigan
316	Growing Old Around the Globe	en	oldglobe	[3, 8]	[6]	 Medicine + Health & Society	 University of Pennsylvania
317	运营管理概论（中文版）	zh-cn	whartonoperationszh	[13]	[6]	 Business & Management	 University of Pennsylvania
318	Algorithms: Design and Analysis, Part 2	en	algo2	[1]	[1]	 Computer Science: Theory	 Stanford University
319	Global Sustainable Energy: Past, Present and Future	en	globalenergy	[25]	[31]	 Energy & Earth Sciences	 University of Florida
320	Computer Networks	en	comnetworks	[4, 11, 15]	[15]	 Information, Tech & Design + Computer Science: Systems & Security + Engineering	 University of Washington
321	The Camera Never Lies	en	lyingcamera	[6, 18]	[26]	 Humanities  + Music, Film, and Audio	 University of London
322	機器學習基石 (Machine Learning Foundations)	zh-tw	ntumlone	[17]	[75]	 Computer Science: Artificial Intelligence	 National Taiwan University
323	L'Art des Structures 2 : treillis, poutres, dalles et cadres	fr	structures2	[15]	[16]	 Engineering	 École Polytechnique Fédérale de Lausanne
324	Algorithmic Thinking (Part 2)	en	algorithmicthink2	[1, 12]	[13]	 Computer Science: Theory + Computer Science: Software Engineering	 Rice University
325	The Bilingual Brain	en	bibrain	[10, 20]	[119]	 Biology & Life Sciences + Social Sciences	 University of Houston System
326	Science from Superheroes to Global Warming	en	scientificthinking	[25]	[30]	 Energy & Earth Sciences	 University of California, Irvine
327	Электричество и магнетизм. Часть 2 (Electricity and Magnetism. Part 2)	ru	electricity2	[23]	[176]	 Physics	 Moscow Institute of Physics and Technology
328	Einführung in Computer Vision	de	compvision	[17]	[78]	 Computer Science: Artificial Intelligence	 Technische Universität München (TUM)
329	An Introduction to Functional Analysis	en	functionalanalysis	[5]	[128]	 Mathematics	 CentraleSupélec
330	Wind, Waves and Tides: Alternative Energy Systems	en	windwavetide	[15, 25]	[11]	 Engineering + Energy & Earth Sciences	 University of Toronto
331	法与社会   Law and Society	zh-cn	sjtula014	[21]	[150]	 Law	 Shanghai Jiao Tong University
332	粒子世界探秘 Exploring Particle World	zh-cn	sjtujxdepw	[9, 23]	[150]	 Physical & Earth Sciences + Physics	 Shanghai Jiao Tong University
333	Supply Chain Management: A Learning Perspective 	en	supplychain	[4, 13, 20]	[178]	 Information, Tech & Design + Business & Management + Social Sciences	 Korea Advanced Institute of Science and Technology
334	Advertising and Society	en	adsoc	[6, 13, 18, 20, 22]	[7]	 Humanities  + Business & Management + Music, Film, and Audio + Social Sciences + Arts	 Duke University
335	Экономика труда (Labor economics)	ru	laborec	[2]	[160]	 Economics & Finance	 Higher School of Economics
336	21st Century American Foreign Policy	en	afp21stcentury	[20]	[7]	 Social Sciences	 Duke University
337	Understanding the Brain: The Neurobiology of Everyday Life	en	neurobio	[3, 8, 10]	[102]	 Medicine + Health & Society + Biology & Life Sciences	 The University of Chicago
338	Моделирование биологических молекул на GPU (Biomolecular modeling on GPU)	ru	biomodeling	[10, 23, 24]	[176]	 Biology & Life Sciences + Physics + Chemistry	 Moscow Institute of Physics and Technology
